{
  "backup_sha256": "6f5c9657b05d1252cd3e71891ac407c12a56f89553037d704486a8cddd0eeb65",
  "candidate_manifest_sha256": "949aef1e8c3ed4bb3a0b8365d350fe57eb446923a489a7b0ba69eb6ff50edbc8",
  "candidate_sha": "c01eb33878e4030975144c5b0ae98e9bdf31ea04",
  "cleanup_status": "DELETED",
  "completed_at": "2026-08-29T20:02:53.402Z",
  "composite_constraints": true,
  "migration_sha256": "5ca9423c2a4eb367d764b3c8830fb6ba2d38bb91f7b70f545576e618928932cf",
  "outbound_side_effects": false,
  "owner_identity_count": 2,
  "postgres_major": 15,
  "read_isolation": true,
  "release_gate_sha": "ccfc0960812ce90deccfc01434da457e1e6934ce",
  "restore_mode": "LOCAL_ISOLATED_DATABASE",
  "restored_fingerprint_sha256": "48231c0c691893d1cdde664821b336d2114d2b10c355e44f2b373912ec77f175",
  "rls_grants_views": true,
  "rollback_verified": true,
  "rpo_seconds": 0.069448,
  "rto_seconds": 0.977171,
  "schema_version": "astrocyte_family_office_local_restore_receipt_v1",
  "source_fingerprint_sha256": "48231c0c691893d1cdde664821b336d2114d2b10c355e44f2b373912ec77f175",
  "started_at": "2026-08-29T20:02:48.550Z",
  "status": "PASS",
  "unsafe_rollback_refused": true,
  "write_isolation": true
}
